title,url,intro,len,methods,len_methods,galdera,galdera_len,erantzuna,erantzuna_len,pausoak,pausoak_len
Cómo cultivar rododendro,http://es.wikihow.com/como-cultivar-rododendro,"Los arbustos de rododendro se cultivan bien en sombra parcial y a temperaturas templadas. Las plantas necesitan suficiente agua, pero también se mueren rápido si las raíces están muy empapadas. En general, puede ser un poco complicado, pero cultivar rododendro en tu jardín o patio puede ser una experiencia enriquecedora.",50,"Preparación: 1- Planta el rododendro a finales de la primavera o a comienzos del otoño. Estas plantas pueden ser un poco particulares y pueden morirse si se plantan cuando el clima es demasiado cálido o frío. Por esta razón, debes pensar en trasplantar los rododendros seleccionados antes de que las temperaturas comiencen a cambiar.
Estas plantas también necesitan ser enfriadas por unas semanas a fin de que produzcan flores fuertes y saludables. Por esta razón, plantar estos arbustos cuando el clima esté un poco frío en realidad puede mejorar la cosecha de flores de tu primera temporada. 2- Elige la ubicación adecuada. Los rododendros se desarrollan muy bien en áreas con sombra desigual, así que debes buscar un lugar soleado que reciba al menos unas horas de sombra durante el día. No elijas un lugar que esté completamente soleado o uno que esté todo el tiempo a la sombra.
También ten en mente cuestiones de inclinación y de viento. Una ubicación que se incline hacia el norte o el este funciona bien porque el arbusto puede protegerse contra vientos secos del sur o del oeste. Como regla general, debes buscar un área que proteja al arbusto contra el viento. Esconderlos detrás de paredes de edificios también puede ayudar a proteger a las plantas. 3- Modifica el suelo. Al sistema de raíces de un rododendro le va muy mal en suelos gruesos y densos. Si el suelo es demasiado grueso, deberás modificarlo mezclando un material orgánico liviano que pueda hacer que la densidad total sea mucho menos compacta.

Modifica la calidad del suelo con materia orgánica. Agrega una mezcla que sea mitad corteza de pino, un cuarto de arena gruesa y un cuarto de tierra de cultivo si tu tierra inicial es parecida al barro. Para suelos arenosos, mezcla en partes iguales tierra de cultivo y materia orgánica, como el compost.
Evita usar turba, ya que puede atrapar mucha humedad.
Los rododendros necesitan un suelo ácido con un pH entre 5.0 y 5.5. Prueba el suelo usando un kit de prueba de pH o llevándolo a un centro agrícola para que lo prueben. Si el suelo es demasiado alcalino, modifícalo agregando mortero, azufre de uso agrícola o sulfato ferroso. Si el suelo tiene un pH menor a 4.5, deberás elevarlo agregando caliza agrícola molida. 4- Prueba el drenaje. El lugar que elijas debe tener un drenaje adecuado, ya que el rododendro se muere rápidamente si las raíces se mantienen empapadas. Si el drenaje es malo, debes tomar medidas para mejorarlo antes de plantar.

Prueba el drenaje de tu ubicación elegida excavando un agujero profundo de 15 cm (6 pulgadas) y llenándolo de agua. El agua debería drenarse en cuatro horas. Si no lo hace, debes considerar instalar un tubo de drenaje para que se lleve el exceso de agua de las raíces.
Alternativamente, si el drenaje de un lugar no es adecuado, también puedes plantar los rododendros en un suelo elevado. 5- Elige plantas saludables. El rododendro casi siempre se planta por medio de trasplante y no con semillas. Elige plantas con hojas saludables color verde oscuro para tu jardín.

Las plantas deben ser de un color verde intenso sin rastros de amarillo. Evita las plantas con hojas marchitas.
Revisa la tierra en los contenedores. Debe estar un poco húmeda. Si la tierra está completamente seca, la planta podría estar en mal estado, incluso si las hojas aún no han comenzado a ponerse amarillas. 6- Planea de antemano en base al clima. En general, los rododendros prefieren climas de las zonas 5 a 8. Si el clima del lugar donde vives es más frío o más cálido, debes tener algunas cosas en mente antes de plantar estos arbustos en tu patio.

Si vives en las zonas cálidas 7 a 11, asegúrate de que el lugar reciba sombra en la tarde y opta por plantas más grandes en lugar de las más pequeñas.

Si vives las zonas frías 3 a 6, considera plantar los arbustos en pleno sol. Necesitarán al menos 6 horas de sol al día para evitar problemas con el moho. También debes estar aún más preparado para el viento.
Ten en cuenta que si ocurren heladas mortales durante el invierno, también deberás proteger a los arbustos contra los vientos invernales. Estas plantas sufren en el frío extremo, así que si quieres que duren hasta la primavera, necesitarás protegerlas envolviendo arpillera alrededor de ellas a finales del otoño. Siembra: 1- Excava un lecho de plantas. A los rododendros les va mejor cuando se les planta en grupos. Excava un lecho de alrededor de 45 cm (18 pulgadas) de profundidad y 75 cm (30 pulgadas) de ancho. Ten en cuenta que cada planta en el grupo debe estar espaciada a alrededor de 90 a 120 cm (3 a 4 pies) de las otras y a 45 cm (18 pulgadas) del extremo del lecho.

Plantar estos arbustos en grupos también facilita la preparación de un lote adecuado de tierra.
No coloques el lecho demasiado cerca de un árbol con raíces superficiales, como un arce, un fresno o un olmo. Estas raíces pueden moverse hacia el suelo y robar el agua y alimento a los rododendros. 2- Excava agujeros poco profundos para las plantas de rododendro. El agujero que excaves para cada planta de rododendro dentro del lecho debe ser ligeramente más grande que el cepellón pero no más profundo. Las raíces superiores deben estar a nivel del suelo.

El cepellón debe estar alrededor de 5 cm (2 pulgadas) más arriba del suelo a su alrededor cuando coloques la planta en el agujero.
Como regla general, es mejor plantar el rododendro a muy poca profundidad que demasiado profundo. 3- Riega después de plantar. Moja la tierra completamente después de plantar el rododendro. Apisona el suelo húmedo alrededor del cepellón para mantenerlo seguro y firme en su lugar. Cuidado diario y a largo plazo: 1- Proporciona suficiente agua durante el verano. Cuando el clima se vuelva cálido y seco, debes asegurarte de que las plantas de rododendro reciban 2.5 cm (1 pulgada) de agua semanalmente.

Deja que las plantas se mantengan relativamente secas a partir de septiembre. Hacerlo las ayudará a sobrevivir en el invierno, pero solo debes regarlas una vez después de la primera helada importante.
Solo necesitas regar los arbustos durante el verano si reciben menos de 2.5 cm (1 pulgada) de lluvia a la semana. 2- Aplica un mantillo anual. Aplica un mantillo fresco cada año durante el otoño. El mantillo puede mantener las raíces húmedas y protegerlas contra el frío clima de invierno.

Las mejores clases de mantillo pueden ser las hojas de roble o agujas de pino parcialmente descompuestas. Otras buenas opciones son virutas de roble, astillas de madera dura, aserrín envejecido y musgo de turbera.
El mantillo de madera debe disponerse de tal manera que esté a 5 cm (2 pulgadas) de profundidad. Las hojas, agujas de pino y musgo deben estar a 10-15 cm (4 a 6 pulgadas) de profundidad.
El mantillo debe permanecer ahí todo el año. Durante el verano y otoño, intenta mantenerlo alejado de los tallos de la planta. Durante el invierno, apílalo más alto para proteger los tallos contra el frío. 3- Abona frugalmente. Usa una pequeña cantidad de abono a principios de la primavera, una vez que los brotes de las flores comiencen a crecer. Resiste la tentación de abonar más que eso, ya que el abono puede quemar las raíces de los rododendros.

Busca un abono diseñado para ser usado con plantas que requieran una alta acidez. Normalmente, este será un abono que proporcione nitrógeno en forma de amonio.
Si estás buscando un abono orgánico, intenta con harina de semilla de algodón.
Cuando abones las plantas, hazlo en mayo. No apliques abono después de fines de junio. 4- Poda las flores muertas. Los arbustos de rododendro no necesitan podarse para estimular el crecimiento. Sin embargo, debes podar las flores viejas durante la temporada de crecimiento y en el otoño.

Si las plantas comienzan a crecer demasiado, pódalas ligeramente cortando una o dos ramas al año. Espera hasta después de que el arbusto florezca.
Técnicamente, puedes podar las plantas de rododendro cortándolas hasta alrededor de 30 cm (12 pulgadas) del suelo, pero hacerlo probablemente retrase el florecimiento por algunos años después ya que estas plantas crecen de forma muy lenta.

Al retirar flores muertas, solo corta la mata muerta. Los brotes para el siguiente año se encuentran solo un poco más allá de las flores muertas y, si recortas demasiado, podrías terminar cortando también esos brotes.
Desprende a mano los tallos de las flores. Simplemente dóblalos hasta que se rompan. 5- Mantente atento a pestes y enfermedades. Si bien los rododendros no son especialmente propensos a pestes y enfermedades, tampoco son inmunes a problemas. Aplica pesticidas y fungicidas solo según sea necesario.

Las orugas y los gusanos tejedores de otoño son los principales problemas en cuanto a insectos se refiere. Si bien raramente destruyen la planta por completo, pueden hacer agujeros en las hojas.
Las enfermedades de las raíces también pueden afectar a los rododendros. Si un rododendro ha muerto de una enfermedad de la raíz, mueve los otros arbustos de rododendro a una nueva ubicación.
Otras posibles pestes incluyen el gorgojo de la vid, moscas blancas, chicharras, chinches de encaje, cochinillas, áfidos, oídio, plaga de los brotes, óxido, agallas de hojas y manchas en los pétalos. ",1565,Nola landu rododendroa,3,"Rododendro zuhaixkak ondo hazten dira itzal partzialean eta tenperatura epeletan. Landareek ur nahikoa behar dute, baina azkar hiltzen dira sustraiak oso bustita badaude. Oro har, konplikatua izan daiteke, baina zure lorategi edo patioan rododendroa lantzea esperientzia aberasgarria izan daiteke.",39,"Prestaketa: 1- Errododendroa udaberriaren amaieran edo udazkenaren hasieran landatzen da. Landare horiek berezi samarrak izan daitezke, eta hil egin daitezke klima beroegia edo hotzegia denean. Hori dela eta, tenperaturak aldatzen hasi baino lehen, hautatutako rododendroak trasplantatzea pentsatu behar duzu.Landare horiek ere aste batzuetan hoztu behar dira, lore sendoak eta osasungarriak sortzeko. Horregatik, klima hotz samarrean dagoenean zuhaixka horiek landatzeak zure lehen denboraldiko loreen uzta hobetu dezake. 2- Aukeratu kokapen egokia. Rododendrondoak oso ondo garatzen dira itzal desberdineko eremuetan; beraz, leku eguzkitsu bat bilatu behar duzu, egunez gutxienez ordu batzuetako itzala jasoko duena.Ez aukeratu guztiz eguzkitsua den leku bat edo itzalean denbora guztian egoten den leku bat. Gogoan izan, halaber, malda- eta haize-kontuak. Iparralderantz edo ekialderantz okertzen den toki batek ondo funtzionatzen du, zuhaixka hego edo mendebaldeko haize lehorretatik babestu daitekeelako.Arau orokor gisa, zuhaixka haizetik babestuko duen eremua bilatu behar duzu. Eraikinetako hormen atzean ezkutatzeak ere lagundu dezake landareak babesten. 3- Lurzorua aldatzen du. Rododendro baten sustrai-sistemari oso gaizki doa lurzoru lodi eta dentsoetan. Lurzorua lodiegia bada, material organiko arina nahastuz aldatu beharko duzu, guztizko dentsitatea askoz trinkoagoa izan dadin.Lurzoruaren kalitatea aldatzen du materia organikoarekin. Gehitu nahasketa bat, pinu-azalaren erdia, harea lodiaren laurdena eta laborantzako lur-laurdena, zure hasierako lurra lokatzaren antzekoa bada. Lurzoru hareatsuetarako, zati berdinetan nahasten dira laborantzako lurra eta materia organikoa, hala nola konposta.Ez erabili zohikatza, hezetasun handia harrapa baitezake. Rododendrondoek 5,0 eta 5,5 arteko pH-a duen lurzoru azidoa behar dute. Probatu lurzorua pH-probako kita erabiliz edo eraman nekazaritza-zentro batera, proba dezaten. Lurzorua alkalinoegia bada, mokaloa morteroa erantsiz, nekazaritzan erabiltzeko sufrea edo burdin sulfatoa.Lurzoruak 4.5 baino pH txikiagoa badu, nekazaritzako kareharri ehoa gehituz igo beharko duzu. 4- Saiatu drainatzen. Aukeratzen duzun tokiak drainatze egokia izan behar du, errododendroa berehala hiltzen baita sustraiak bustita mantentzen badira. Drainatzea txarra bada, landatu aurretik hobetzeko neurriak hartu behar dituzu.Probatu aukeratutako kokalekuko drainatzea, 15 cm-ko (6 hazbeteko) zulo sakona hondeatuz eta urez betez. Ura lau ordutan drainatu beharko litzateke. Hala egiten ez baduzu, drainatze-hodi bat jarri behar duzu sustraietako gehiegizko ura eramateko. Bestela, leku bateko drainatzea egokia ez bada, harkaitzak ere lur altuan landatu ditzakezu.5- Hautatu landare osasungarriak. Rododendroa ia beti birlandaketa bidez landatzen da, ez hazien bidez. Aukeratu zure lorategirako hosto osasungarri berde ilunak dituzten landareak. Landareek kolore berde bizia izan behar dute, horizko arrastorik gabe. Saihestu hosto zimeldunak dituzten landareak. Begiratu lurra edukiontzietan.Heze samar egon behar du. Lurra erabat lehor badago, landarea egoera txarrean egon liteke, baita hostoak horiak jartzen hasi ez badira ere. 6- Aurrez klimaren arabera planeatzen du. Oro har, rododendrondoek nahiago dituzte 5-8 eremuetako klimak. Bizi zaren lekuko klima hotzagoa edo beroagoa bada, zuhaixka hauek zure patioan landatu baino lehen gauza batzuk gogoan izan behar dituzu.7tik 11ra bitarteko eremu beroetan bizi bazara, ziurtatu lekuak itzala jasotzen duela arratsaldean, eta hautatu landare handiagoak, txikienen ordez. Eremu hotzak bizi badituzu (3-6), kontuan izan zuhaixkak eguzki betean landatuko dituzula. Egunean gutxienez 6 eguzki-ordu beharko dituzte lizunarekin arazorik ez izateko.Haizerako ere prestatuago egon behar duzu. Kontuan izan neguan izozte hilgarriak gertatzen badira, neguko haizeetatik ere babestu beharko dituzula zuhaixkak. Landare hauek oso hotzean sufritzen dute; beraz, udaberrira arte irautea nahi baduzu, babestu egin beharko dituzu udazkenaren amaieran haien inguruan arpillera bilduz.Ereintza: 1- Aitzinatu landare-ohantze bat. Rododendrondoak hobeto moldatzen dira taldeka hazten direnean. 45 cm (18 hazbete) inguruko sakonera eta 75 cm (30 hazbete) zabaleko ohantzea gainditzen du. Kontuan izan taldeko solairu bakoitzak 90-120 cm (3-4 oin) inguruko tartea izan behar duela, eta ohantzearen muturretik 45 cm (18 hazbete) ingurukoa.Zuhaixka horiek taldeka jartzeak lur-lote egokia prestatzea ere errazten du. Ez jarri ohea lur gaineko sustraiak dituen zuhaitz baten inguruan, hala nola astigar bat, lizar bat edo zumar bat. Sustrai horiek lurrerantz mugi daitezke eta ura eta janaria rododendrondoei lapurtu.2- Rododendro erako sakonera txikiko zuloak ditu. Ohantzearen barruan, rododendra-landare bakoitzerako zuloa egiten baduzu, orratza baino handixeagoa izango da, baina ez sakonagoa. Goiko sustraiek lurzoruaren mailan egon behar dute. Landarea zuloan jartzen duzunean, inguruko lurretik 5 cm (2 hazbete) gorago egon behar du arrabotak.Oro har, hobe da rododendroa oso sakonera txikian landatzea sakonera handiegian baino. 3- Ureztatu landatu ondoren. Busti lurra erabat rododendroa landatu ondoren. Lurzoru hezea sustrai-lurrazalaren inguruan pilatzen du, bere lekuan seguru eta tinko mantentzeko. Zaindu egunero eta epe luzera: 1- Behar adina ur ematen du udan.Klima bero eta lehor bihurtzen denean, ziurtatu rododendro landareek 2,5 cm (hazbete bat) ur jasotzen dutela astero. Irailetik aurrera, landareak nahiko lehor mantentzen dira. Horrek neguan bizirik irauten lagunduko die, baina lehenengo izozte garrantzitsuaren ondoren bakarrik ureztatu behar dituzu.Astean 2,5 cm (hazbete bat) baino euri gutxiago jasotzen badute soilik ureztatu behar dituzu zuhaixkak udan. 2- Eman urteko mantxo bat. Jarri zapi fresko bat urtero udazkenean. Gurinak sustraiak hezeak izan ditzake eta neguko klima hotzetik babestu.Mantelo-mota onenak haritz-hostoak edo partzialki deskonposatutako pinu-orratzak izan daitezke. Beste aukera on batzuk haritz-txirbilak, zur gogorrezko ezpalak, zerrauts zahartua eta zohikaztegiko goroldioa dira. Zurezko gurina 5 cm-ko (2 hazbeteko) sakoneran jarri behar da.Hostoek, pinu- eta goroldio-orratzek 10-15 cm-ko sakonera izan behar dute (4-6 hazbete). Urte osoan egon behar du hor manteloak. Udan eta udazkenean, saiatu landarearen zurtoinetatik urrun egoten. Neguan, pilatu altuago zurtoinak hotzetik babesteko.3- Frugalki ondu da. Erabili ongarri kantitate txiki bat udaberriaren hasieran, loreen kimuak hazten hasten direnean. Hori baino gehiago ordaintzeko tentazioari aurre egiten dio, ongarriak erretako erroak erre baititzake. Azidotasun handia behar duten landareekin erabiltzeko diseinatutako ongarria bilatu.Normalean, ongarri horrek amonio itxurako nitrogenoa ematen du. Ongarri organikoaren bila bazabiltza, saia zaitez kotoizko hazi-irinarekin. Ondu landareak, eta egin maiatzean. Ekaineko hutsegiteen ondoren ordainduko da. 4- Lore hilak inaustea. Errododendroko zuhaixkak inausi egin behar dira, hazkundea bultzatzeko.Hala ere, lore zaharrak inausi behar dituzu hazkunde-garaian eta udazkenean. Landareak gehiegi hazten hasten badira, palak pixka bat moztuko dira urtean adar bat edo bi moztuz. Zuhaixka loratu arte itxaron. Teknikoki, rododendro landareak inausi ditzakezu lurretik 30 cm (12 hazbete) inguru moztuta, baina, segur aski, loraldia urte batzuk geroago atzeratzen da, landare horiek oso poliki hazten baitira.Lore hilak kentzean, hildako mata baino ez du mozten. Hurrengo urteko kimuak hildako loreetatik pixka bat haratago daude, eta gehiegi mozten baduzu, kimu horiek ere moztu ahal izango dituzu. Loreen zurtoinak eskuz askatzen ditu. Tolestu, apurtu arte.5- Adi egon pesteei eta gaixotasunei. Nahiz eta rododendrondoak ez diren izurrite eta gaixotasunetarako bereziki egokiak, ez dira immuneak ere arazoengatik. Beharrezkoa denean bakarrik aplikatzen ditu pestizidak eta fungizidak. Orugak eta udazkeneko zizare ehuleak dira intsektuen arazo nagusiak.Oso gutxitan landare osoa suntsitzen badute ere, hostoetan zuloak egin ditzakete. Sustraietako gaixotasunek ere eragina izan dezakete rododendroetan. Errododendro bat sustraiko gaixotasun baten ondorioz hil bada, beste zuhaixkak lekuz aldatuko ditu. Beste fitxa batzuk ere izan daitezke: mahatsondoaren gorgojoa, euli zuriak, txitxarroak, ahokatzeko zimitzak, txerrikumeak, azidoak, idioa, kimuen izurria, oxidoa, hostoen zakatzak eta petaloetako orbanak.",1088
