title,url,intro,len,methods,len_methods,galdera,galdera_len,erantzuna,erantzuna_len,pausoak,pausoak_len
Cómo darle vuelta a la pantalla de tu computadora,http://es.wikihow.com/como-darle-vuelta-a-la-pantalla-de-tu-computadora,"¿Alguna vez has necesitado darle vuelta a la pantalla de la computadora de modo que la imagen quede completamente invertida? Tal vez necesites ver gráficos desde otro ángulo o ajustar una pantalla montada de forma extraña, o quizás simplemente te gustaría hacerle una broma a un compañero de trabajo. No importa cuál sea el motivo: darle vuelta a la pantalla de la computadora es una tarea sencilla.",67,"Windows: 1- Prueba con los atajos del teclado. Si tienes un adaptador gráfico Intel, puedes usar los atajos del teclado para rotar la pantalla. Prueba con los atajos mostrados a continuación y, si no funcionan, continúa leyendo las instrucciones sobre cómo rotar la pantalla:


Ctrl+Alt+↓: invierte la pantalla (quedará al revés).

Ctrl+Alt+→: rota la pantalla 90° a la derecha.

Ctrl+Alt+←: rota la pantalla 90° a la izquierda.

Ctrl+Alt+↑: regresa a la orientación normal de la pantalla. 2- Inténtalo desde la ventana ""Resolución de pantalla"". Si los atajos del teclado no dieron resultado, tal vez puedas rotar la pantalla desde la ventana ""Resolución de pantalla"" o ""Propiedades de pantalla"". Puedes abrir esta ventana haciendo clic derecho en el escritorio y seleccionando ""Resolución de pantalla"", o yendo a ""Propiedades"" y luego haciendo clic en la pestaña ""Pantalla"" (solo para Windows XP).
Utiliza el menú desplegable ""Orientación"" para seleccionar cómo quieres que se muestre tu pantalla. Después de unos segundos, la configuración regresará a la normalidad a menos que aceptes los cambios. 3- Determina qué tarjeta gráfica tienes. El proceso para rotar la pantalla depende de la tarjeta gráfica que estés usando. Es posible que los controladores de la tarjeta gráfica estén anulando los controles de rotación de Windows. Si sabes qué tarjeta gráfica tienes, será más fácil encontrar los controles de rotación.

Presiona Wind+R y escribe dxdiag. Se abrirá la herramienta de diagnóstico de DirectX.
Haz clic en la pestaña ""Pantalla"". Si tienes instalada una tarjeta NVIDIA, lee el próximo paso. Si tienes instalada una tarjeta AMD o ATI, lee el paso 5. 4- Rota la pantalla con una tarjeta NVIDIA. Si tienes una tarjeta gráfica NVIDIA, puedes usar el panel de control de NVIDIA para rotar la pantalla. Si tienes una tarjeta gráfica AMD o ATI, omite este paso y continúa con el próximo.

Haz clic derecho en el escritorio y selecciona ""Panel de control de NVIDIA"".
Selecciona ""Rotar pantalla"" en el menú izquierdo debajo de la categoría ""Pantalla"".
Selecciona la pantalla que quieras rotar.
Elige la orientación que quieras que use la pantalla o utiliza los botones para rotarla de a 90° por vez. 5- Rota la pantalla con una tarjeta AMD o ATI. Si tienes una tarjeta gráfica AMD o ATI, puedes usar ""Catalyst Control Center"" para rotar la pantalla.

Haz clic derecho en el escritorio y selecciona ""Catalyst Control Center"".
Selecciona ""Rotate Desktop"" (rotar escritorio) debajo de ""Common Display Tasks"" (tareas comunes de la pantalla). Si no encuentras esta opción, necesitarás actualizar los controladores (lee el próximo paso).
Selecciona en el menú desplegable la pantalla que quieras rotar.
Selecciona la orientación que quieras que muestre la pantalla. 6- Si no puedes rotar la pantalla, actualiza los controladores. La razón más común por la cual no puedes rotar la pantalla, es porque los controladores han dejado de funcionar o están desactualizados. Generalmente, si actualizas los controladores a su versión más reciente esta opción vuelve a habilitarse y además puedes obtener un mejor rendimiento.

Visita el sitio web de NVIDIA o AMD, dependiendo de cuál sea el fabricante de tu tarjeta gráfica. Si no estás seguro, utiliza la herramienta de diagnóstico de DirectX (lee el paso 3).
Ejecuta la herramienta de detección automática para que el sitio web escanee tu computadora y detecte el modelo de tu tarjeta gráfica. También puedes usar la información de la herramienta de diagnóstico de DirectX para buscar tu modelo directamente.
Descarga e instala los controladores más recientes. El instalador eliminará automáticamente los controladores viejos e instalará la versión más reciente. En la mayoría de los casos, simplemente puedes dejar la configuración predeterminada del instalador.
Intenta rotar la pantalla otra vez. Ahora que los controladores están instalados, podrás usar alguno de los métodos anteriores para rotar tu pantalla. Mac OS X: 1- Haz clic en el menú de Apple y selecciona ""Preferencias del sistema"". Si vas a usar Mavericks (10.9) o una versión anterior, puedes forzar tu Mac para que rote cualquier pantalla que esté conectada. Si vas a usar Yosemite, solo puedes rotar aquellas pantallas que sean compatibles con esta función. 2- Abre el menú ""Pantallas"". La forma en la que abras esta opción para ver las opciones de rotación dependerá de la versión de OS X que vayas a usar:

Mavericks (10.9) y versiones anteriores: presiona ⌘ Command+⌥ Option y haz clic en la opción ""Pantallas"".
Yosemite (10.10) y versiones posteriores: haz clic en la opción ""Pantallas"". Si usas ⌘ Command+⌥ Option para intentar abrir la opción ""Pantallas"" en Yosemite, podría producirse un serio error. 3- Haz clic en el menú ""Girar o rotación"" y selecciona la orientación que quieras usar. Si no ves un menú de rotación en Yosemite, es posible que tu pantalla no sea compatible con esa función. Este es normalmente el caso de las pantallas internacionales de MabBooks e iMacs. 4- Abre la pestaña ""Alineación"" (Yosemite). Cuando rotes una pantalla en Yosemite y tengas varias pantallas conectadas, todas ellas rotarán. Puedes solucionarlo abriendo la pestaña ""Alineación"" y quitando la marca de la casilla ""Pantallas duplicadas"". ",836,Nola eman buelta ordenagailuaren pantailari,5,"Inoiz eman behar izan diozu buelta ordenagailuaren pantailari, irudia erabat alderantzikatuta gera dadin? Agian, beste angelu batetik grafikoak ikusi beharko dituzu, edo modu bitxian muntatutako pantaila bat doitu, edo, agian, lankide bati txantxa bat egin nahiko zenioke. Ez du axola zein den arrazoia: ordenagailuaren pantailari buelta ematea lan erraza da.",50,"Windows: 1- Egin proba teklatuko lasterbideekin. Intel egokigailu grafiko bat baduzu, teklatuko lasterbideak erabil ditzakezu pantaila biratzeko. Egin proba ondoren agertzen diren lasterbideekin, eta, funtzionatzen ez badute, jarraitu irakurtzen pantaila nola biratu: Ctrl+Alt+: inbertitu pantaila (alderantziz geldituko da).Ktrl+Alt+: pantaila 90° biratzen du eskuinerantz. Ctrl+Alt+:rota la pantalla 90° ezkerrera. Ktrl+Alt+: pantailaren orientazio normalera itzultzen da. 2- Saiatu ""Pantailaren bereizmena"" leihotik. Teklatuko lasterbideak emaitzarik eman ez badu, agian ""Pantaila-bereizmena"" edo ""Pantaila-propietateak"" leihotik biratu ahal izango duzu pantaila.Leiho hori irekitzeko, egin klik eskuinean mahaigainean eta aukeratu ""Pantailaren bereizmena"", edo joan ""Propietateak"" atalera, eta, gero, sakatu ""Pantaila"" fitxa (Windows xp-rentzat bakarrik). Erabili ""Orientazioa"" goitibeherako menua pantaila nola agertzea nahi duzun hautatzeko. Segundo batzuen ondoren, konfigurazioa normaltasunera itzuliko da aldaketak onartzen ez badituzu.3- Zehaztu zer txartel grafiko duzun. Pantaila biratzeko prozesua erabiltzen ari zaren txartel grafikoaren araberakoa da. Baliteke txartel grafikoaren kontrolatzaileak Windowsen errotazio-kontrolak ezeztatzen aritzea. Zer txartel grafiko duzun baldin badakizu, errazagoa izango da errotazio-kontrolak aurkitzea.Sakatu Wind+R eta idatzi dxdiag. DirectX-en diagnostiko-tresna irekiko da. Egin klik ""Pantaila"" fitxan. NVIDIA txartela instalatuta baduzu, irakurri hurrengo pausoa. AMD edo ATI txartela instalatuta baduzu, irakurri 5. urratsa. 4- Hautsi pantaila NVIDIA txartelarekin. NVIDIA txartel grafikoa baduzu, NVIDIA kontrol-panela erabil dezakezu pantaila biratzeko.AMD edo ATI txartel grafikoa baduzu, ez egin urrats hau eta segi hurrengoarekin. Egin klik eskuinean mahaigainean eta hautatu ""NVIDIA kontrol-panela"". Hautatu ""Biratu pantaila"" ezkerreko menuan, ""Pantaila"" kategoriaren azpian. Hautatu biratu nahi duzun pantaila. Aukeratu pantailan erabili nahi duzun orientazioa edo erabili botoiak 90º-tik 90º-ra txandatzeko.5- Hautsi pantaila AMD edo ATI txartelarekin. AMD edo ATI txartel grafikoa baduzu, ""Catalyst Control Center"" erabil dezakezu pantaila biratzeko. Egin klik eskuinean mahaigainean eta hautatu ""Catalyst Control Center"". Hautatu ""Rotate Desktop"" (biratu mahaigaina) ""Common Display Tasks""-en azpian (pantailako ohiko atazak).Aukera hau aurkitzen ez baduzu, kontrolatzaileak eguneratu beharko dituzu (irakurri hurrengo pausoa). Hautatu goitik beherako menuan biratu nahi duzun pantaila. Hautatu pantailan agertzea nahi duzun orientazioa. 6- Pantaila biratu ezin baduzu, eguneratu kontrolatzaileak. Kontrolatzaileek funtzionatzeari utzi diotelako edo eguneratu gabe daudelako da pantaila biratu ezin izateko arrazoi nagusia.Normalean, kontrolatzaileak bertsio berrienean eguneratzen badituzu, aukera hori berriro gaituko da eta, gainera, errendimendu hobea lor dezakezu. Zatoz NVIDIA edo AMDren webgunera, zure txartel grafikoaren fabrikatzailearen arabera. Ziur ez bazaude, erabili DirectX-en diagnostiko-tresna (irakurri 3. urratsa).Exekutatu automatikoki detektatzeko tresna, webguneak zure ordenagailua eskaneatu eta zure txartel grafikoaren eredua detekta dezan. DirectX-en diagnostiko-tresnaren informazioa ere erabil dezakezu zure eredua zuzenean bilatzeko. Kontrolatzaile berrienak deskargatu eta instalatu. Instalatzaileak automatikoki ezabatuko ditu kontrolatzaile zaharrak eta bertsio berriena instalatuko du.Gehienetan, instalatzailearen konfigurazio lehenetsia utz dezakezu. Saiatu pantaila berriz biratzen. Kontrolatzaileak instalatuta daudenean, aurreko metodoren bat erabil dezakezu pantaila biratzeko. Mac OS X: 1- Egin klik Apple-ren menuan eta hautatu ""Sistemaren lehentasunak"".Mavericks (10.9) edo aurreko bertsio bat erabili behar baduzu, Mac-a behartu dezakezu konektatuta dagoen edozein pantaila hautsi dezan. Yosemit-en erabili behar baduzu, funtzio horrekin bateragarriak diren pantailak bakarrik biratu ditzakezu. 2- ""Pantailak"" menua irekitzen du. Biraketa-aukerak ikusteko aukera hori erabiliko duzun OS X-ren bertsioaren araberakoa izango da: Mavericks (10.9) eta aurreko bertsioak: presiona Command+ Option eta egin klik ""Pantailak"" aukeran.Yosemititzen (10.10) eta ondorengo bertsioak: egin klik ""Pantailak"" aukeran. ΟCommand+ Option erabiltzen baduzu Yosemiten ""Pantailak"" aukera irekitzen saiatzeko, errore larria gerta liteke. 3- Egin klik ""Biratu edo biratu"" menuan, eta hautatu erabili nahi duzun orientazioa. Yosemiten errotazio-menurik ikusten ez baduzu, baliteke zure pantaila funtzio horrekin bateragarria ez izatea.Hori da, normalean, MabBooks eta iMacs-en nazioarteko pantailen kasua. 4- Ireki ""Lerrokadura"" fitxa (Yosemititzen du). Pantaila bat Yosemiten biratzen duzunean eta hainbat pantaila konektatuta dituzunean, denak biraka arituko dira. ""Lerrokatu"" fitxa irekiz eta ""Pantaila bikoiztuak"" laukiko marka kenduz konpon dezakezu.",578
