title,url,intro,len,methods,len_methods,galdera,galdera_len,erantzuna,erantzuna_len,pausoak,pausoak_len
Cómo bajar la presión arterial durante el embarazo de manera natural,http://es.wikihow.com/como-bajar-la-presion-arterial-durante-el-embarazo-de-manera-natural,"Según la Asociación Americana del Embarazo, la hipertensión afecta aproximadamente del 6 al 8 % de las embarazadas. Si tu presión arterial excede los 140 mm Hg de presión sistólica (el número más alto) o 90 mm Hg de presión diastólica (el número más bajo), entonces sufres de presión arterial alta, o hipertensión. Algunos factores de riesgo de la hipertensión relacionado al embarazo son el sobrepeso, haber tenido hipertensión antes del embarazo, embarazo múltiple, alguna enfermedad crónica o una dieta deficiente (dietas con un alto consumo de sal y grasas). Como la hipertensión lleva a complicaciones (bebés de bajo peso, problemas renales, nacimientos prematuros y preeclampsia), debes tomar los pasos para bajar la presión arterial alta durante el embarazo.",119,"Bajar la presión arterial con elecciones de estilo de vida: 1- Sé activa. Las mujeres inactivas tienen mayores riegos de sufrir hipertensión que aquellas que hacen ejercicio. Así que aunque estés embarazada o tengas pensado procrear, consulta con tu doctor sobre la idea de iniciar un programa de ejercicios.

Procura hacer ejercicios como mínimo 30 minutos al día o la mayor cantidad de días durante la semana.
Si eres principiante, prueba la caminata o natación de baja intensidad.
Siempre consulta con tu doctor antes de iniciar un programa de ejercicios y pregúntale si es seguro que hagas ciertas actividades. 2- Controla tu peso. El sobrepeso es un factor de riesgo de la hipertensión, por eso tienes que tomar precauciones para que tu aumento de peso por el embarazo esté dentro de los límites saludables. Una dieta adecuada y el ejercicio regular controlará tu aumento de peso durante el embarazo.

La preeclampsia es un tipo de hipertensión inducido por el embarazo que puede aparecer por subir demasiado de peso durante el embarazo. Esto puede producir problemas renales y hepáticos para la madre y complicaciones para el bebé.

El sobrepeso también aumenta el riesgo de sufrir otras afecciones durante el embarazo, tales como el dolor de espalda, cansancio, calambres de pierna, hemorroides, diabetes gestacional, acidez estomacal y dolor de articulaciones. 3- Reduce el estrés. El estrés puede elevar la presión arterial ya estés embarazada o no. Si te es posible, procura eliminar toda fuente de estrés.

No trabajes en exceso durante el embarazo. Si trabajas más de 41 horas a la semana, puede elevar tu riesgo de sufrir hipertensión.

Prueba con las técnicas de relajación como la meditación, la visualización y el yoga. Esto puede aportar serenidad a tu cuerpo y mente, y ayudar a reducir tus niveles de estrés. 4- Prueba con la respiración controlada. Las técnicas de respiración, tales como la respiración diafragmática, puede ayudar a calmar el cuerpo y la mente, y calmar el estrés. Además, al usar el diafragma (el músculo ubicado en la base de los pulmones) harás que tu respiración sea más potente y reducirá el esfuerzo de los demás músculos del cuello y del pecho.

Recuéstate cómodamente boca arriba o siéntate. Si te recuestas, pon una almohada debajo de tus rodillas para mantenerlas flexionadas.

Para sentir el movimiento de tu diafragma, pon tus manos en el pecho y debajo de la caja torácica.
Inhala lentamente por la nariz para que sientas cómo sube tu vientre.
Exhala lentamente por la boca contando hasta 5 mientras contraer los músculos abdominales y los dejas caer hacia dentro.
Repítelo y respira regular y lentamente. 5- Ponte a escuchar música. Los estudios han demostrado que escuchar el tipo correcto de música mientras se respira lentamente por lo menos 30 minutos al día puede bajar la presión arterial.

Escucha música relajante como la música celta, clásica o hindú. Si tienes otro tipo de música lenta que te guste mucho, te inspire y te relaje, escúchala.
Evita la música fuerte y rápida como el rock, el pop y el heavy metal, ya que podrían darte el efecto contrario. 6- Revisa bien tus medicamentos. La hipertensión es un efecto colateral de algunos medicamentos. Conversa con tu doctor sobre tus medicamentos para saber si su consumo es seguro durante el embarazo. 7- Deja de fumar. Además de ser un peligro para tu bebé, el cigarrillo puede elevar la presión arterial. Si estás embarazada, debes dejar de fumar inmediatamente.
Conversa con tu doctor sobre algunos método para dejar de fumar que sean seguros para ti y tu bebé. Bajar la presión arterial con dieta: 1- Evita la sal y los alimentos con un alto contenido de sal. Si bien el organismo requiere sodio en pequeñas cantidades, el exceso de sodio es perjudicial y puede producir hipertensión, enfermedades cardiovasculares y embolias. Si sufres de hipertensión, toma medidas para reducir tu ingesta de sodio:

No agregues sal a los alimentos durante la cocción, más bien utiliza otras especias (comino, pimienta, hierbas frescas).
Lava los alimentos enlatados para retirar el sodio.
Compra alimentos cuya etiqueta diga “bajo en sodio” o “sin sodio”.
Evita los alimentos procesados, tales como las galletas, las frituras, los productos de panadería y pastelería, que suelen ser altos en sodio.
También evita la comida rápida y cuando estés en un restaurante, pide un platillo con sodio reducido. 2- Come más granos integrales. Los granos integrales son altos en fibra dietaria. Por su parte, los estudios han demostrado que una dieta con mayor fibra puede reducir la hipertensión.

Asegúrate de consumir como mínimo de 6 a 8 porciones de granos integrales todos los días.
Cambia los granos refinados por los granos integrales, por ejemplo, cámbiate al arroz integral y a la pasta y al pan de trigo integral. 3- Añade alimentos ricos en potasio a tu dieta. Los alimentos ricos en potasio deben ser parte de tu dieta de control de la hipertensión. Los alimentos que debes incluir son: camotes, tomates, frijoles rojos, jugo de naranja, bananas, guisantes, papas, frutas deshidratadas y melón.
Procura que tus niveles de potasio sean moderados (aproximadamente de 2.000 a 4.000 mg al día). 4- Date un gustito con chocolate negro. Según cierto estudio clínico, el chocolate negro podría contribuir a bajar la presión arterial.

Come al día 15 g (½ oz) de chocolate negro que tenga por lo menos 70 % de cacao.

Como el chocolate negro es alto en calorías, asegúrate de no excederte. 5- Evita el alcohol y las bebidas con cafeína. Además de ser malos para la presión arterial, la cafeína y el alcohol también producen otros efectos negativos para la salud de la madre y del bebé durante el embarazo. Por eso, debes evitar ambos, especialmente si sufres de hipertensión.

La ingesta de cafeína durante el embarazo se ha vinculado con una menor circulación sanguínea placentaria y el riesgo de aborto espontáneo. Si bien son necesarios más estudios para confirmar los efectos de la cafeína, los mejor es cambiarse a las opciones descafeinadas durante el embarazo.

El alto consumo de alcohol eleva la presión arterial y también produce efectos negativos en el feto. Antes de beber alcohol, aunque sea una copa de vino solamente, consúltalo con tu doctor. 6- Añade productos de soya y de leche semidescremada a tu dieta, si no lo has hecho ya. Cierto estudio clínico demostró que la presión arterial sistólica puede bajarse añadiendo esos alimentos a la dieta.

Añade productos lácteos semidescremados o descremados (como leche, queso cottage, yogur) a tu dieta.
Si eres intolerante a la lactosa, prueba más bien con productos de soya.
Ten cuidado con la cantidad de queso que comas (aunque sea bajo en grasa) debido a su alto contenido de sal. ",1116,Nola jaitsi arteria-presioa haurdunaldian modu naturalean,6,"Haurdunaldiaren Amerikako Elkartearen arabera, hipertentsioak haurdunen %6 eta %8 artean eragiten du. Presio arteriala 140 mmHg baino handiagoa bada presio sistolikoa (kopururik altuena) edo 90 mmHg baino handiagoa bada presio diastolikoa (kopururik baxuena), orduan arteria-presio altua edo hipertentsioa izango duzu.Haurdunaldiarekin lotutako hipertentsioaren arrisku-faktore batzuk hauek dira: gehiegizko pisua, haurdunaldia baino lehen hipertentsioa, haurdunaldi anizkoitza, gaixotasun kronikoren bat edo dieta txarra (gatz eta koipe asko kontsumitzen duten dietak). Hipertentsioak konplikazioak eragiten dituenez (pisu gutxiko haurtxoak, giltzurrunetako arazoak, jaiotza goiztiarrak eta eklanpsia aurrekoak), haurdunaldian arteria-presio altua jaisteko urratsak egin behar dituzu.",89,"Presio arteriala jaistea, bizimoduaren arabera: 1- Izan aktibo. Emakume ez-aktiboek ariketek baino arrisku handiagoa dute hipertentsioa jasateko. Beraz, haurdun bazaude edo ugaltzeko asmoa baduzu ere, galdetu medikuari ariketa-programa bat hasteko ideiari buruz. Saiatu egunean gutxienez 30 minutuz ariketak egiten, edo astean ahalik eta egun gehien egiten.Hasiberria bazara, probatu ibilaldia edo intentsitate txikiko igeriketa. Galdetu beti medikuari ariketa-programa bat hasi aurretik, eta galdetu ea seguru egiten dituzun zenbait jarduera. 2- Kontrolatu zure pisua. Gehiegizko pisua hipertentsioaren arrisku-faktore bat da. Horregatik, kontuz ibili behar duzu haurdunaldiko zure pisu-hazkuntza muga osasungarrien barruan egon dadin.Dieta egoki batek eta ariketa erregularrak kontrolatuko dute haurdunaldian zure pisua handitzea. Preeklanpsia haurdunaldiak eragindako hipertentsio mota bat da, eta haurdunaldian pisu gehiegi igotzeagatik ager daiteke. Horrek giltzurrun- eta gibel-arazoak eragin diezazkioke amari, eta arazoak sor diezazkioke haurrari.Gehiegizko pisuak haurdunaldian beste gaitz batzuk izateko arriskua ere areagotzen du, hala nola bizkarreko mina, nekea, hankako karranpak, hemorroideak, haurdunaldiko diabetesa, urdaileko azidotasuna eta artikulazioetako mina. 3- Estresa murrizten du. Estresak arteria-presioa handitu dezake, haurdun egon ala ez. Ahal baduzu, kendu estres-iturri guztiak.Ez lan gehiegi egin haurdunaldian. Astean 41 ordu baino gehiago lan egiten baduzu, hipertentsioa izateko arriskua handitu dezakezu. Proba itzazu erlaxazio-teknikak, hala nola meditazioa, bisualizazioa eta yoga. Horrek lasaitasuna eman diezaioke zure gorputzari eta adimenari, eta estres-maila murrizten lagundu dezake.4- Egin proba arnasketa kontrolatuarekin. Arnasketa-teknikek, hala nola arnasketa diafragmatikoak, gorputza eta burua lasaitzen eta estresa lasaitzen lagun dezakete. Gainera, diafragma (biriken oinarrian dagoen muskulua) erabiltzean, zure arnasketa indartsuagoa izango da, eta lepoko eta bularreko gainerako muskuluen esfortzua murriztuko du.Etzan ahoz gora, eroso, edo eseri. Estaltzen badituzu, jarri burko bat belaunen azpian, tolestuta izateko. Zure diafragmaren mugimendua sentitzeko, jarri eskuak bularrean eta kaxa torazikoaren azpian. Arnastu poliki-poliki sudurretik, zure sabela nola igotzen den senti dezazun.Bota ahoa estalita, eta kontatu 5 arte muskulu abdominalak uzkurtu eta barrurantz botatzen dituzun bitartean. Errepikatu eta hartu arnasa erregularra eta delikatua. 5- Jarri musika entzuten. Ikerketek frogatu dute musika mota egokia entzuteak, arnasa azkar hartzen duen bitartean, gutxienez 30 minutuz jaits dezakeela arteria-presioa.Musika lasaigarria entzuten du, musika zelta, klasikoa edo hindua kasu. Asko gustatzen zaizun bestelako musika motela baduzu, inspiratu eta erlaxatu, entzun. Saihestu musika indartsu eta azkarra, hala nola rocka, popa eta heavy metala, kontrako efektua eman baitezakete. 6- Berrikusi ondo zure botikak.Hipertentsioa sendagai batzuen albo-ondorioa da. Hitz egin medikuarekin zure botikei buruz, haurdunaldian horien kontsumoa segurua den jakiteko. 7- Utzi erretzeari. Zure haurrarentzat arriskutsua izateaz gain, zigarroak arteria-presioa handitu dezake. Haurdun bazaude, berehala utzi behar diozu erretzeari.Esaiozu medikuari erretzeari uzteko zuretzat eta zure haurrarentzat seguruak diren metodo batzuei buruz. Jaitsi presio arteriala dietarekin: 1- Saihestu gatza eta gatz asko duten elikagaiak. Organismoak sodio gutxi behar duen arren, sodio-soberakina kaltegarria da eta hipertentsioa, gaixotasun kardiobaskularrak eta enboliak eragin ditzake.Hipertentsioa baduzu, hartu neurriak sodio gutxiago hartzeko: ez bota gatzik elikagaiei egosten ari zaren bitartean, beste espezia batzuk erabili (kuminoa, piperbeltza, belar freskoak). Garbitu latako elikagaiak, sodioa kentzeko. Erosi “sodio gutxiko” edo “sodio gutxiko” etiketa duten elikagaiak. Saihestu elikagai prozesatuak, hala nola galletak, frijituak, okintzako eta gozogintzako produktuak, sodio asko izaten baitute.Halaber, saihestu janari lasterra, eta jatetxe batean zaudenean, eskatu sodio murriztuko platertxoa. 2- Ale integral gehiago jaten ditu. Osoko pikorrak handiak dira dieta-zuntzean. Bestalde, ikerketek frogatu dute zuntz handiagoko dieta batek hipertentsioa murriztu dezakeela. Egunean 6-8 ale integral kontsumitu, gutxienez.Aldatu ale finduen ordez ale integralak, adibidez, aldatu arroz integrala eta pasta eta gari-ogi integrala. 3- Gehitu potasio askoko elikagaiak zure dietan. Potasio asko duten elikagaiek hipertentsioa kontrolatzeko zure dietaren parte izan behar dute. Elikagai hauek sartu behar dituzu: kamoteak, tomateak, babarrun gorriak, laranja-zukua, bananak, ilarrak, patatak, fruta deshidratatuak eta meloia.Saia zaitez zure potasio-maila neurritsua izaten (gutxi gorabehera, egunean 2.000 eta 4.000 mg artean). 4- Dastatu txokolate beltza. Azterketa kliniko baten arabera, txokolate beltzak arteria-presioa jaisten lagun dezake. Egunean 15 g (½ oz) txokolate beltz jaten du, gutxienez %70 kakaoa duena.Txokolate beltza kaloria asko dituenez, ziurtatu ez zarela gehiago kontsumitzen. 5- Saihestu alkohola eta kafeinadun edariak. Arteria-presiorako txarrak izateaz gain, kafeinak eta alkoholak beste ondorio negatibo batzuk ere sortzen dituzte amaren eta haurraren osasunerako haurdunaldian.Horregatik, biak saihestu behar dituzu, batez ere hipertentsioa baduzu. Haurdunaldian kafeina hartuz gero, plazentako odol-zirkulazio txikiagoa izan da, eta abortu espontaneoa izateko arriskua. Kafeinaren ondorioak egiaztatzeko azterketa gehiago egin behar diren arren, onenak haurdunaldian deskafeinatutako aukeretara aldatzea da.Alkohol asko edateak presio arteriala areagotzen du, eta fetuari ere ondorio negatiboak eragiten dizkio. Alkohola edan aurretik, ardo-kopa hutsa izan arren, galdetu zure medikuari. 6- Gehitu soia eta esne erdigaingabetuaren produktuak zure dietan, dagoeneko egin ez baduzu.Zenbait ikerketa klinikok frogatu zuen arteria-presio sistolikoa murriztu egin daitekeela, elikagai horiek dietari erantsiz. Gehitu esneki erdigaingabetuak edo gaingabetuak (esnea, gazta cottagea, jogurta) zure dietan. Laktosarekiko intolerantea bazara, proba ezazu soia-produktuekin. Kontuz ibili jaten duzun gaztarekin (nahiz eta gantz gutxi izan), gatz asko duelako.",773
