title,url,intro,len,methods,len_methods,galdera,galdera_len,erantzuna,erantzuna_len,pausoak,pausoak_len
Cómo pintar los aros de las ruedas de tu auto,http://es.wikihow.com/como-pintar-los-aros-de-las-ruedas-de-tu-auto,"¿Buscas darle estilo a tu auto? o ¿tu viejo auto necesita una renovación? Pintar las ruedas podría ser ese toque especial que necesitas. Si bien puedes llevarlo a un taller mecánico para esto, también es posible hacerlo por tu cuenta. Si estás dispuesto a dedicarle un fin de semana y te entusiasma la idea de pintar, este proyecto casero es ideal para ti.",63,"Quitar las ruedas: 1- Afloja las tuercas de la rueda con una llave de cruceta o de impacto. Es la manera más segura de aflojarlas. Mientras el auto aún se encuentra sobre el suelo, esto pone presión en las ruedas. Así se mantienen en su lugar y puedes aflojar las tuercas sin el giro de las ruedas. 2- Levanta el auto. Consulta el manual de servicio para saber cuáles son los puntos de fijación del gato recomendados. Así evitarás los daños innecesarios al auto. Coloca el gato por debajo de dichos puntos y levanta el auto. 3- Estabiliza el auto con soportes para gato. Si bien necesitas un gato para levantar el auto en el aire, no es seguro que este descanse en un gato. Nuevamente, consulta el manual de servicio para ver los puntos de fijación y desliza los soportes por debajo de ellos. Baja el auto con el gato y apoya el vehículo sobre dichos soportes.
Si levantas la parte frontal o la parte trasera, debe haber un soporte en cada lado del auto. Si lo levantas todo, deben haber dos soportes en cada lado, cerca de cada esquina. 4- Retira las tuercas de la rueda. Una vez que el auto esté elevado y bien apoyado, puedes retirar las tuercas de la rueda. Deben estar lo bastante sueltas para sacarlas con la mano. De lo contrario, sácalas con una llave de cruceta o de impacto. 5- Quita la rueda de su base. Una vez retiradas las tuercas, tira de las ruedas del auto. Sigue este mismo procedimiento para cada una de las cuatro. Llévalas a un espacio de trabajo apropiado. 6- Haz que retiren las llantas de las ruedas. Dado que es muy difícil hacerlo de forma segura sin el equipo especializado, es mejor que se encarguen de esto en un taller mecánico o una vulcanizadora.
Aunque no es obligatorio, retirar las llantas disminuye el tiempo que te demoras en cubrir el aro metálico y descarta la probabilidad de rociarlas en exceso. Retirarlas también te permitirá asegurarte de pintar hasta el borde del aro sin ninguna interferencia. 7- Retira el vástago de válvula. Al igual que el retiro de las llantas, este paso es opcional. Sacar el vástago de válvula de los aros te permite pintar sin necesidad de cubrirlo. Además, elimina la dificultad de intentar pintar en distintos ángulos para evitar omitir partes del aro que el vástago de válvula podría bloquear. Esto permitirá un movimiento de rociado más natural y lograr un mejor trabajo de pintura. Lijar y limpiar las ruedas: 1- Limpia las ruedas con agua y jabón. Este primer paso es necesario para eliminar la mayor cantidad posible de suciedad de las ruedas. De este modo, también identificarás las marcas de abolladuras, golpes o de oxidado en las ruedas. Asimismo, podrás lijar con más facilidad y eficacia. 2- Limpia las ruedas con un desengrasante y desencerante. Por lo general, este producto se trata de un solvente apolar como las esencias minerales (al contrario del agua que es un solvente polar). Disuelve sustancias que el agua no puede, como los aceites. Es una buena forma de limpiar lo que no hayas podido limpiar con el agua jabonosa. 3- Lija las ruedas. Como mínimo, vas a necesitar una escobilla de alambre de acero para quitar el óxido por completo. Lo ideal es lijar las ruedas con chorro de arena para quitar el óxido y la pintura vieja o los desechos pegados. Así tendrás la mejor superficie para empezar a pintar. Después, lija la rueda completa con papel de lija de grano 300 y luego uno de grano 500. De este modo, eliminarás los raspones ásperos y dejarás solo una superficie lisa con rayas muy finas a las que la pintura podrá adherirse y cubrir.
Una vez que hayas terminado el lijado, debes poder pasar los dedos por la rueda y sentir una superficie homogénea y lisa. No deben haber marcas o zonas ásperas en la rueda. 4- Rocía agua en las ruedas. Debes eliminar cualquier desecho que haya quedado del lijado. Retira todo el polvo que sea posible. Esto te permitirá realizar un trabajo de pintura limpio. Si no dispones de una manguera, puedes echar agua en las ruedas con un balde. 5- Seca las ruedas. Utiliza aire comprimido en las grietas difíciles de alcanzar. Asegúrate de eliminar por completo el agua (junto con el polvo). Recuerda que las ruedas deben quedar del todo limpias para imprimarlas y pintarlas. También es posible secarlas con una franela, pero asegúrate de no dejar ningún rastro de agua en la superficie. Cubrir y preparar las ruedas para pintarlas: 1- Elige un lugar dónde pintar. El lugar ideal es uno con la menor cantidad posible de polvo. También debes considerar rociar el suelo y las paredes para disminuir el riesgo de levantar polvo. Una buena ventilación es indispensable, ya que contribuye a eliminar el polvo y otros contaminantes, además de retirar el excedente de pintura y disolvente de la habitación. 2- Ponte equipo protector. Es necesario para protegerte de las sustancias tóxicas presentes en la pintura, además de proteger el trabajo de pintura contra cualquier elemento que caiga de tu cuerpo. Cubrir la cabeza y el cuerpo ayuda a minimizar el riesgo de que caigan pelos o pelusas sobre la superficie de pintura. Por seguridad, mínimo necesitas una mascarilla o un respirador.
Las pinturas o los disolventes de pintura (también llamados reductores, rebajadores, diluyentes o adelgazadores) contienen compuestos orgánicos volátiles que son inflamables y tóxicos. Es peligroso inhalarlos y penetran la piel y los ojos. 3- Coloca cinta adhesiva alrededor del perímetro de la superficie que vas a pintar. La cinta adhesiva debe delinear la parte del aro que quieres pintar sin toparla. La parte de la rueda que vas a pintar no debe tener nada de cinta. Este proceso puede ser lento y tedioso, dependiendo del diseño de la rueda y de si has retirado las llantas y el vástago de válvula. 4- Cubre toda la rueda con una envoltura de plástico o papel. Esta será la principal protección contra el rociado excesivo. Si impides que el excedente de pintura caiga sobre otras superficies de la rueda, ahorrarás mucho tiempo en su limpieza posterior. En caso de que rocíes lugares indeseables, deberás eliminar el excedente de pintura con un lubricante y una barra de arcilla. 5- Corta el plástico con una navaja. Corta el centro del plástico para exponer la parte de la rueda que deseas pintar. Cubre con cinta la parte exterior del círculo que has formado (los bordes cortados del plástico) hasta la primera capa de cinta que has colocado. También cubre con cinta el resto de los bordes de plástico. De este modo, impedirás que el exceso de pintura entre en contacto con la parte restante de la rueda. Imprimar y pintar las ruedas: 1- Limpia la superficie que vas a pintar con un desengrasante y desencerante. Es necesario realizar una última limpieza para quitar el exceso de suciedad y polvo de las ruedas. El desengrasante y desencerante también elimina los aceites que dejan las manos o la piel mientras trabajas con las ruedas. Seca la superficie con una toalla de papel limpia en vez de dejar que el producto se evapore. 2- Aplica una imprimación en las ruedas. La imprimación brinda una superficie ideal para la adhesión de la pintura y contribuye a evitar la oxidación. También ofrece un color uniforme a lo largo de la superficie y le da un aspecto parejo a la pintura por toda la rueda. Debes aplicar 2 o 3 capas de imprimación. Lee las instrucciones del producto y espera el tiempo recomendado entre cada capa para evitar que se corran.
Necesitarás al menos una imprimación autograbante para impedir la oxidación del metal. Según la calidad del trabajo de pintura que desees obtener, también existen imprimaciones diseñadas especialmente para ciertos tipos de pintura. Consulta con el distribuidor de tus autopartes o pinturas para saber qué imprimación te conviene más. 3- Revisa las ruedas. Al terminar de aplicar la imprimación, podrás notar las imperfecciones que hayas omitido durante el proceso. Si observas alguna, debes lijar la imprimación, corregir la imperfección y volver a aplicar la imprimación. Esta es la última oportunidad de dejar perfectas las ruedas antes de continuar con la pintura.
La pintura se aplica en capas muy finas. Aunque puedes ignorar algunas imperfecciones muy leves, la pintura no las esconde bien. 4- Pinta las ruedas. Como ocurre con la imprimación, debes aplicar la pintura en varias capas homogéneas (normalmente, tres). Debes dejar reposar la pintura por el tiempo recomendado antes de colocar la siguiente capa. Rocía de un lado a otro a lo largo de la superficie, a un ritmo uniforme. No te acerques mucho a la superficie o te muevas muy lento, de lo contrario, la pintura se correrá. Si te mueves con mucha rapidez, no lograrás una buena cobertura. 5- Aplica la capa transparente. Esto solo es obligatorio si estás utilizando una capa de pintura base o transparente. Omite este paso si la pintura es de una sola etapa. Debes aplicar la capa transparente de la misma forma que la pintura y la imprimación: tres capas homogéneas dejando un tiempo de espera entre cada aplicación. Deja reposar la pintura por 24 horas antes de pulir o volver a montar las ruedas.
Ten presente que la capa transparente se corre con más facilidad que la capa base o imprimación. Pulir las ruedas: 1- Lija las zonas sucias. Estas lucen como polvo en el trabajo de pintura (y eso es lo que son). Líjalas con un papel de lija de grano muy fino, por ejemplo, de 2000. Para facilitarte el pulido, repasa estos rasguños de papel de lija con otro de grano aún más fino: 3000. 2- Pule los rasguños. No necesitas utilizar el compuesto para pulir en todo el trabajo de pintura (a menos que parezca opaco). Pero sí es necesario utilizarlo (que suele ser el primer paso en un sistema de pulido de varios pasos) en cualquier zona lijada. Lija ligeramente hasta dejar de ver rasguños de papel de lija.

Ten presente que mover el pulidor muy lento, dejarlo atrapado en una esquina o pulir a una velocidad muy elevada puede quemar o pelar la pintura.
Limpia el exceso de producto para pulir con una mezcla de agua y alcohol isopropílico. 3- Quita la cinta adhesiva, el plástico o el papel restante. Una vez que hayas acabado de pintar y pulir, ya no es necesario mantener cubiertas las ruedas. Al momento de retirar las cubiertas de las ruedas, verifica que no las hayas rociado en exceso con pintura. Si es así, elimina el excedente con un lubricante y una barra de arcilla. 4- Aplica cera abrillantadora en las ruedas. Este suele ser el segundo paso en un sistema de pulido. En ocasiones, existe incluso un tercer paso que permite lograr un brillo aún mayor. Aplica la cera abrillantadora con un pulidor a baja velocidad y una almohadilla de espuma suave. Luego límpiala con un trapo de microfibra limpio.
No utilices silicona o cera tradicional en la pintura fresca. Si la sellas, el producto no se ventilará de forma adecuada y se producirán burbujas o turbiedad en el trabajo de pintura. ",1873,Nola margotu zure autoaren gurpiletako uztaiak,6,"Zure autoari estiloa eman nahi diozu? o zure auto zaharrak berritzea behar du? Behar duzun ukitu berezia izan liteke gurpilak pintatzea. Lantegi mekaniko batera eraman dezakezu horretarako, baina zuk ere egin dezakezu. Asteburu bat emateko prest bazaude eta pintatzeko ideia gustuko baduzu, etxeko proiektu hau aproposa da zuretzat.",48,"Kendu gurpilak: 1- Askatu gurpilaren azkoinak gurutze- edo talka-giltza batekin. Lasaitzeko modurik seguruena da. Autoa zoruan dagoen bitartean, horrek presioa egiten du gurpiletan. Horrela mantentzen dira eta azkoinak gurpilak biratu gabe lasaitu ditzakezu.2- Altxatu autoa. Kontsultatu zerbitzu-eskuliburua katuaren finkatze-puntuak zein diren jakiteko. Horrela, autoak behar ez dituen kalteak saihestuko dituzu. Jarri katua puntu horien azpian, eta altxatu autoa. 3- Egonkortu autoa katuentzako euskarriekin. Autoa airean altxatzeko katu bat behar baduzu ere, ez da segurua katu batean lo egingo duzunik.Berriro ere, kontsultatu zerbitzu-eskuliburua finkatze-puntuak ikusteko eta euskarriak haien azpitik irristatzeko. Jaitsi autoa katuarekin eta sostengatu ibilgailua euskarri horien gainean. Aurrealdea edo atzealdea altxatzen baduzu, euskarri bat egon behar du autoaren alde bakoitzean.Dena altxatzen baduzu, bi euskarri egon behar dute alde bakoitzean, ertz bakoitzetik gertu. 4- Kendu azkoinak gurpiletik. Autoa altxatuta eta ondo bermatuta dagoenean, gurpileko azkoinak ken ditzakezu. Nahikoa solte egon behar dute eskuarekin ateratzeko. Bestela, atera gurutze- edo talka-giltza batekin.5- Kendu gurpila oinarritik. Azkoinak kendutakoan, tira egin autoari. Jarraitu prozedura honi lau horietako bakoitzerako. Eraman itzazu lan-eremu egoki batera. 6- Kendu gurpiletako hagunak. Oso zaila denez modu seguruan egitea ekipo espezializaturik gabe, hobe da lantegi mekaniko batean edo bulkanizagailu batean lan egitea.Derrigorrezkoa ez den arren, hagunak kentzeak metalezko uztaia estaltzen atzeratzen duzun denbora murrizten du eta gehiegi ihinztatzeko aukera baztertzen du. Horiek kentzeak aukera emango dizu uztaiaren ertzeraino inolako eragozpenik gabe pintatzeko. 7- Kendu balbula-zurtoina. Hagunen erretiroa bezala, aukerakoa da.Uztaietatik balbula-zurtoina ateratzean, estali gabe margotu dezakezu. Gainera, zenbait angelutan pintatzen saiatzeko zailtasuna kentzen du, balbula-zurtoinak blokea ditzakeen eraztun-zatiak ez kentzeko. Horri esker, ihinztatze-mugimendu naturalagoa egingo da, eta pintura-lan hobea lortuko da.Lixatu eta garbitu gurpilak: 1- Garbitu gurpilak urez eta xaboiz. Lehenengo urrats hori beharrezkoa da gurpiletako ahalik eta zikinkeria gehien kentzeko. Horrela, mailatuen, kolpeen edo gurpiletako oxidazioaren markak ere identifikatuko dituzu. Gainera, errazago eta eraginkortasun handiagoz lixatu ahal izango duzu.2- Garbitu gurpilak koipegabetzaile eta deskoipeztatzaile batekin. Oro har, produktu hau esentzia mineralak bezala apolatzen den disolbatzailea da (urarena ez bezala, disolbatzaile polarra baita). Urak ezin dituen substantziak disolbatzen ditu, olioak esaterako. Garbitzeko modu egokia da xaboi-urarekin garbitu ezin izan duzuna.3- Lixatu gurpilak. Gutxienez, altzairuzko alanbre-erratz bat beharko duzu oxidoa erabat kentzeko. Gurpilak harea-zorrotadaz lixatzea da egokiena, oxidoa eta pintura zaharra edo itsatsitako hondakinak kentzeko. Hala, pintatzen hasteko azalerarik onena izango duzu.Ondoren, lixatu gurpil osoa 300 aleko lizpaperarekin, eta, ondoren, 500 aleko ale batekin. Horrela, orratz latzak kenduko dituzu, eta gainazal leun bat baino ez duzu utziko, marra oso finekin, pintura itsatsi eta estali ahal izateko. Lixatu ondoren, hatzak gurpilaren gainetik pasatu eta gainazal homogeneoa eta leuna sentitu behar duzu.Gurpilean ez da markarik edo eremu latzik egon behar. 4- Ura gurpiletan marruskatzen du. Lixatzetik geratu den edozein hondakin ezabatu behar duzu. Ahal den hauts guztia atera. Horrela, pintura garbiko lana egin ahal izango duzu. Mahukarik ez baduzu, balde batekin bota dezakezu ura gurpiletara.5- Lehortu gurpilak. Lortzen zailak diren arrailetan aire konprimitua erabiltzen du. Ziurtatu ura erabat ezabatu behar duzula (hautsarekin batera). Gogoratu gurpilak erabat garbi utzi behar direla inprimatu eta margotzeko. Franela batekin ere lehortu daitezke, baina ez utzi ur-arrastorik gainazalean.Marrazteko gurpilak: 1- Aukeratu pintatzeko leku bat. Leku egokiena hauts gutxien duen bat da. Halaber, lurzorua eta hormak ihinztatu behar ditu, hauts-arriskua murrizteko. Aireztapen egokia ezinbestekoa da, hautsa eta beste kutsatzaile batzuk sortzen baititu, eta, gainera, gelatik pintura eta disolbatzaile soberakina kentzen du.2- Jarri babes-ekipoa. Beharrezkoa da pinturan dauden substantzia toxikoetatik babesteko, eta pintura zure gorputzetik erortzen den edozein elementutatik babesteko. Burua eta gorputza estaltzea lagungarria da pinturaren azalean ileak edo ileak erortzeko arriskua gutxitzeko.Segurtasunagatik, gutxienez maskara edo arnasgailu bat behar duzu. Pinturek edo pintura-disolbatzaileek (erreduktoreak, beheragailuak, diluitzaileak edo mehetzaileak ere deitzen zaie) konposatu organiko lurrunkorrak dituzte, sukoiak eta toxikoak. Arriskutsua da arnastea eta azala eta begiak sartzea. 3- Pintatu behar duzun gainazalaren perimetroaren inguruan zinta itsasgarria jarri.Zinta itsasgarriak ukitu gabe pintatu nahi duzun eraztunaren zatia delineatu behar du. Pintatuko duzun gurpil-zatiak ez du zintarik izan behar. Prozesu hori motela eta aspergarria izan daiteke, gurpilaren diseinuaren eta hagunak eta balbula-zurtoina kendu dituzun kontuan hartuta.4- Estali gurpil osoa plastikozko edo paperezko bilgarri batekin. Hori izango da gehiegizko ihinztatzearen aurkako babes nagusia. Pintura-soberakina gurpilaren beste gainazal batzuetara erortzea eragozten baduzu, denbora asko aurreztuko duzu ondorengo garbiketan. Nahi ez dituzun lekuak urratuz gero, pintura-soberakina labaingarri batekin eta buztin-barra batekin kendu beharko duzu.5- Moztu plastikoa labana batekin. Moztu plastikoaren erdigunea pintatu nahi duzun gurpilaren zatia erakusteko. Estali zintaz osatu duzun zirkuluaren kanpoko aldea (plastikoaren ertzak), jarri duzun lehen zinta-geruzaraino. Plastikozko gainerako ertzak ere zintaz estaltzen ditu.Horrela, pintura gehiegi gurpilaren gainerako zatiarekin kontaktuan jartzea eragotziko duzu. Gurpilak inprimatzea eta pintatzea: 1- Pintatu behar duzun azala koipegabetzailearekin eta argizaria kentzearekin garbitzen du. Azken garbiketa egin behar da gurpiletako gehiegizko zikinkeria eta hautsa kentzeko.Koipegabetzaileak eta argizaria ematen duenak, halaber, eskuak edo azala uzten dituzten olioak kentzen ditu gurpilekin lan egiten duzun bitartean. Lehortu gainazala eskuoihal garbi batekin, produktua lurrundu beharrean. 2- Inprimazio bat aplikatzen du gurpiletan. Inprimazioak gainazal ezin hobea ematen du pintura itsasteko eta oxidazioa saihesten laguntzen du.Kolore uniformea ere ematen du gainazalean, eta antzeko itxura ematen dio pinturari gurpil osoan. 2 edo 3 inprimazio-geruza eman behar dituzu. Irakurri produktuaren jarraibideak, eta itxaron geruza bakoitzak zenbat denbora behar duen korrika egin ez dezan.Inprimazio autograbatzaile bat beharko duzu gutxienez, metalaren oxidazioa eragozteko. Lortu nahi duzun pintura-lanaren kalitatearen arabera, inprimazioak ere badaude, pintura-mota batzuetarako bereziki diseinatuak. Kontsultatu zure autoparteen edo pinturen banatzailearekin, gehien komeni zaizun inprimazioa zein den jakiteko. 3- Berrikusi gurpilak.Inprimazioa aplikatu ondoren, prozesuan zehar egin ez dituzun akatsak nabaritu ahal izango dituzu. Zerbait ikusten baduzu, inprimazioa lixatu, akatsa zuzendu eta inprimazioa berriro aplikatu behar duzu. Pinturarekin jarraitu aurretik gurpilak txukun uzteko azken aukera da hau. Pintura oso geruza meheetan aplikatzen da.Akats oso arin batzuk alde batera utzi baditzakezu ere, pinturak ez ditu ongi gordetzen. 4- Margotu gurpilak. Inprimazioarekin gertatzen den bezala, pintura hainbat geruza homogeneotan eman behar duzu (normalean hiru geruzatan). Hurrengo geruza jarri baino lehen, pintura pausatzen utzi behar duzu. Alde batetik bestera marruskatzen du gainazalean, erritmo uniformean.Ez hurbildu gehiegi azalera edo astiro mugitu; bestela, pintura korrika joango da. Azkar mugitzen bazara, ez duzu estaldura onik lortuko. 5- Eman geruza gardena. Oinarrizko pintura-geruza edo geruza gardena erabiltzen ari bazara baino ez da nahitaezkoa hori. Ez egin urrats hori pintura etapa bakarrekoa bada.Geruza gardena pintura eta inprimazioaren modu berean aplikatu behar duzu: hiru geruza homogeneo, aplikazio batetik bestera itxaron beharreko denbora utziz. Utzi pintura 24 orduz, leundu edo gurpilak berriz muntatu baino lehen. Kontuan izan geruza gardena oinarrizko geruza edo inprimazioa baino errazago irristatzen dela.Leundu gurpilak: 1- Lixatu eremu zikinak. Pintura-lanean hauts gisa jokatzen dute (eta hori da zer diren). Garbitu pikor fineko lixa batekin, adibidez, 2000rekin. Leunketa errazteko, errepasa itzazu lizpaperezko orratz hauek ale finagoko batekin: 3000.2- Leundu ziriak. Ez duzu konposatua erabili behar pintura-lan osoan leuntzeko (opakua dirudien kasuetan izan ezik). Baina beharrezkoa da edozein eremu lixatutan erabiltzea (zenbait urratsetako leunketa-sistema bateko lehen urratsa izaten da). Lixatu pixka bat, lizpaperezko orratzak ikusi arte.Kontuan izan leungailua oso motel mugitzeak, izkina batean harrapatuta uzteak edo oso abiadura handian leuntzeak pintura erre edo zuritu dezakeela. Gehiegizko produktua garbitzen du, ura eta alkohol isopropilikoa nahastuta leuntzeko. 3- Kendu zinta itsasgarria, plastikoa edo gainerako papera.Pintatu eta leundu ondoren, ez da beharrezkoa gurpilak estalita edukitzea. Gurpilen estalkiak kentzeko unean, egiaztatu pinturaz gehiegi busti ez dituzula. Hala bada, lubrifikatzaile batekin eta buztin-barra batekin ezabatzen du soberakina.4- Jarri argizari distirarazlea gurpiletan. Hori izan ohi da leunketa-sistema baten bigarren urratsa. Batzuetan, distira are handiagoa lortzeko hirugarren urrats bat ere badago. Aplikatu distira ematen duen argizaria, abiadura txikiko leungailu batekin eta apar leuneko kuxin batekin. Ondoren, garbitu mikrozuntzezko trapu garbi batekin.Ez erabili silikona edo argizari tradizionalik pintura freskoan. Zigiluak egokiak badira, produktua ez da behar bezala aireztatuko, eta burbuilak edo uhertasuna sortuko dira pintura-lanean.",1259
